{
  "id": "code-reviewer",
  "name": "Code Reviewer",
  "description": "Performs comprehensive code reviews with security analysis, best practices, and improvement suggestions",
  "longDescription": "Code Reviewer provides thorough code review capabilities directly in Claude Code. It analyzes your code for security vulnerabilities, adherence to best practices, potential bugs, and suggests improvements.\n\n## Usage\n\nRun `/review` to review staged changes, or `/review <file>` to review a specific file.\n\n## Features\n\n- Security vulnerability detection (OWASP Top 10)\n- Best practices analysis\n- Performance optimization suggestions\n- Code style recommendations\n- Complexity analysis",
  "version": "1.0.0",
  "author": {
    "name": "Claude Plugins",
    "github": "awolfden"
  },
  "type": "skill",
  "categories": ["code-quality", "development"],
  "tags": ["code-review", "security", "best-practices", "linting"],
  "repository": "https://github.com/awolfden/claude-plugins",
  "installation": {
    "type": "settings-json",
    "config": {
      "skills": {
        "review": {
          "command": "/review",
          "description": "Perform a comprehensive code review",
          "prompt": "Review the specified code for security vulnerabilities, bugs, best practices violations, and potential improvements. Provide actionable feedback organized by severity."
        }
      }
    },
    "instructions": "Add the following to your Claude Code settings.json under the 'skills' key"
  },
  "requirements": {
    "platforms": ["macos", "linux", "windows"]
  },
  "license": "MIT",
  "createdAt": "2025-02-13",
  "updatedAt": "2025-02-13"
}
